{
  "target": "aarch64-qemu-virt",

  "components": {
    "char_device.serial": {
      "impl": "uart_pl011",
      "config": {
        "base_addr": "0x09000000"
      }
    },
    "scheduler": {
      "impl": "sched_rr",
      "config": {}
    },
    "memory.page_alloc": {
      "impl": "mm_buddy",
      "config": {}
    },
    "filesystem.root": {
      "impl": "ramfs",
      "config": {}
    },
    "filesystem.proc": {
      "impl": "procfs",
      "config": {}
    },
    "vfs": {
      "impl": "vfs_simple",
      "config": {}
    }
  },

  "connections": [],

  "hooks": [],

  "posix": {
    "enabled": false
  }
}
